"title","author","subject","abstract","date"
"action functional as early warning indicator in the space of probability measures","peng zhang, ting gao, jin guo, jinqiao duan","dynamical systems","in neuroscience, scientists have some hypotheses on the brain's critical dynamics, which means the brain may stay in a phase transition state between ordered and disordered activities. some tipping points, as a past of no return, can be critical for neural diseases. therefore, a key question is how the critical brain hypothesis relates to pathological conditions compared with normal brain functionality. action functional between two meta-stable states in stochastic dynamical systems is a good tool to study the critical transition and tipping. here we extend the conventional onsager-machlup action functional of finding the most probable transition pathway to be looking for the evolutionary transition dynamics between two meta-stable invariant sets. hence a rich theory from schrödinger bridge and optimal transport is brought in to solve this problem. furthermore, different from various early warning indicators via statistics, bifurcation theory, information theory, statistical physics, topology, graph theory, we propose a novel viewpoint of early warning indicators in the space of probability measure, which facilitates us to build indicators based on action functional. to validate our framework, we apply this methodology to a morris-lecar model introduced to analyze the transition dynamics between a meta-stable state and the homo-clinic orbit. besides, the real alzheimer's data from adni database is also investigated to study the early warning signals of transition from healthy to pre-ad states. this framework not only extends the transition path to be pathway measures between two given densities on invariant sets but also shows potential ability for early warning indicators or biomarkers in complex diseases.",2024-03-15
"modeling the spread of covid-19 in university communities","jeffrey w. herrmann, hongjie liu, donald k. milton","populations and evolution","mathematical and simulation models are often used to predict the spread of a disease and estimate the impact of public health interventions, and many such models have been developed and used during the covid-19 pandemic. this paper describes a study that systematically compared models for a university community, which has a much smaller but more connected population than a state or nation. we developed a stochastic agent-based model, a deterministic compartment model, and a model based on ordinary differential equations. all three models represented the disease progression with the same susceptible-exposed-infectious-recovered (seir) model. we created a baseline scenario for a population of 14,000 students and faculty and eleven other scenarios for combinations of interventions such as regular testing, contact tracing, quarantine, isolation, moving courses online, mask wearing, improving ventilation, and vaccination. we used parameter values from other epidemiological studies and incorporated data about covid-19 testing in college park, maryland, but the study was designed to compare modeling approaches to each other using a synthetic population. for each scenario we used the models to estimate the number of persons who become infected over a semester of 119 days. we evaluated the models by comparing their predictions and evaluating their parsimony and computational effort. the agent-based model (abm) and the deterministic compartment model (dcm) had similar results with cyclic flow of persons to and from quarantine, but the model based on ordinary differential equations failed to capture these dynamics. the abm's computation time was much greater than the other two models' computation time. the dcm captured some of the dynamics that were present in the abm's predictions and, like those from the abm, clearly showed the importance of testing and moving classes on-line.",2024-03-15
"a fischer type decomposition theorem from the apolar inner product","j. m. aldaz, h. render","analysis of pdes","we continue the study initiated by h. s. shapiro on fischer decompositions of entire functions, showing that such decomposition exist in a weak sense (we do not prove uniqueness) under hypotheses regarding the order of the entire function $f$ to be expressed as $f= p\cdot q+r$, the polynomial $p$, and bounds on the apolar norm of homogeneous polynomials of degree $m$. these bounds, previously used by khavinson and shapiro, and by ebenfelt and shapiro, can be interpreted as a quantitative, asymptotic strengthening of bombieri's inequality. in the special case where both the dimension of the space and the degree of $p$ are two, we characterize for which polynomials $p$ such bounds hold.",2024-03-15
"learning of nash equilibria in risk-averse games","zifan wang, yi shen, michael m. zavlanos, karl h. johansson","optimization and control","this paper considers risk-averse learning in convex games involving multiple agents that aim to minimize their individual risk of incurring significantly high costs. specifically, the agents adopt the conditional value at risk (cvar) as a risk measure with possibly different risk levels. to solve this problem, we propose a first-order risk-averse leaning algorithm, in which the cvar gradient estimate depends on an estimate of the value at risk (var) value combined with the gradient of the stochastic cost function. although estimation of the cvar gradients using finitely many samples is generally biased, we show that the accumulated error of the cvar gradient estimates is bounded with high probability. moreover, assuming that the risk-averse game is strongly monotone, we show that the proposed algorithm converges to the risk-averse nash equilibrium. we present numerical experiments on a cournot game example to illustrate the performance of the proposed method.",2024-03-15
"fano fibrations and dk conjecture for relative grassmann flips","marco rampazzo","algebraic geometry","given a vector bundle $\mathcal e$ on a smooth projective variety $b$, the flag bundle $\mathcal f l(1,2,\mathcal e)$ admits two projective bundle structures over the grassmann bundles $\mathcal g r(1, \mathcal e)$ and $g r(2, \mathcal e)$. the data of a general section of a suitably defined line bundle on $\mathcal f l(1,2,\mathcal e)$ defines two varieties: a cover $x_1$ of $b$ and a fibration $x_2$ on $b$ with general fiber isomorphic to a smooth fano variety. we construct a semiorthogonal decomposition of the derived category of $x_2$ which consists of a list of exceptional objects and a subcategory equivalent to the derived category of $x_1$. as a byproduct, we obtain a new full exceptional collection for the fano fourfold of degree $12$ and genus $7$. any birational map of smooth projective varieties which is resolved by blowups with exceptional divisor $\mathcal f l(1, 2, \mathcal e)$ is an instance of a so-called grassmann flip: we prove that the dk conjecture of bondal-orlov and kawamata holds for such flips. this generalizes a previous result of leung and xie to a relative setting.",2024-03-15
"scattering between a vortex dipole and a point vortex: insights from a new phase plane","atul anurag, roy h. goodman, ellison k. o'grady","dynamical systems","we study the scattering of a vortex dipole by a point vortex in the helmholtz model of point-vortex interactions. we reduce a system of three vortices by stages to a one-degree-of-freedom conservative system. we relate properties of the scattering dynamics to features in the phase space of the reduced system. we first change variables to the jacobi coordinates, followed by a nambu reduction. this shows that the natural phase space of this problem is the upper sheet of a two-sheeted hyperboloid, which degenerates to an upper half-cone in a critical case. gröbli (1877) derived the standard reduction of this system in which the system's state is represented by the lengths of the triangle's sides. the new coordinate system overcomes two related shortcomings of gröbli's reduction that have made understanding the dynamics difficult: the lack of a phase plane and the singularity at all configurations in which the vortices are collinear. we then generalize the problem to consider when the circulation of the third, initially stationary, vortex differs from the circulations of the two that form the propagating dipole.",2024-03-15
"hessian-free force-gradient integrators","kevin schäfers, jacob finkenrath, michael günther, francesco knechtli","numerical analysis","we propose a new framework of hessian-free force-gradient integrators that do not require the analytical expression of the force-gradient term based on the hessian of the potential. due to that the new class of decomposition algorithms for separable hamiltonian systems with quadratic kinetic energy may be particularly useful when applied to hamiltonian systems where an evaluation of the hessian is significantly more expensive than an evaluation of its gradient, e.g. in molecular dynamics simulations of classical systems. numerical experiments of an n-body problem, as well as applications to the molecular dynamics step in the hybrid monte carlo (hmc) algorithm for lattice simulations of the schwinger model and quantum chromodynamics (qcd) verify these expectations.",2024-03-15
"a graded schur lemma and a graded-monoidal structure for induced modules over graded-commutative algebras","jürgen fuchs, tobias grøsfjeld","quantum algebra","we consider algebras and frobenius algebras, internal to a monoidal category, that are graded over a finite abelian group. for the case that a is a twisted group algebra in a linear abelian monoidal category we obtain a graded generalization of the schur lemma for the category of induced a-modules. we further show that if the monoidal category is braided and a is commutative up to a bicharacter of the grading group, then the category of induced a-modules can be endowed with a graded-monoidal structure that is twisted by the bicharacter. in the particular case that the grading group is z/2z, these findings reproduce known results about superalgebras and super-monoidal structures.",2024-03-15
"an inflated dynamic laplacian to track the emergence and disappearance of semi-material coherent sets","jason atnip, gary froyland, péter koltai","fluid dynamics","lagrangian methods continue to stand at the forefront of the analysis of time-dependent dynamical systems. most lagrangian methods have criteria that must be fulfilled by trajectories as they are followed throughout a given finite flow duration. this key strength of lagrangian methods can also be a limitation in more complex evolving environments. it places a high importance on selecting a time window that produces useful results, and these results may vary significantly with changes in the flow duration. we show how to overcome this drawback in the tracking of coherent flow features. finite-time coherent sets (ftcs) are material objects that strongly resist mixing in complicated nonlinear flows. like other materially coherent objects, by definition they must retain their coherence properties throughout the specified flow duration. recent work [froyland and koltai, cpam, 2023] introduced the notion of semi-material ftcs, whereby a balance is struck between the material nature and the coherence properties of ftcs. this balance provides the flexibility for ftcs to come and go, merge and separate, or undergo other changes as the governing unsteady flow experiences dramatic shifts. the purpose of this work is to illustrate the utility of the inflated dynamic laplacian introduced in [froyland and koltai, cpam, 2023] in a range of dynamical systems that are challenging to analyse by standard lagrangian means, and to provide an efficient meshfree numerical approach for the discretisation of the inflated dynamic laplacian.",2024-03-15
"eigenstate thermalization hypothesis for wigner-type matrices","volodymyr riabov, lászló erdős","probability","we prove the eigenstate thermalization hypothesis for general wigner-type matrices in the bulk of the self-consistent spectrum, with optimal control on the fluctuations for observables of arbitrary rank. as the main technical ingredient, we prove rank-uniform optimal local laws for one and two resolvents of a wigner-type matrix with regular observables.",2024-03-15
"resolving full-wave through-wall transmission effects in multi-static synthetic aperture radar","francis watson, daniel andre, william robert breckon lionheart","numerical analysis","through-wall synthetic aperture radar (sar) imaging is of significant interest for security purposes, in particular when using multi-static sar systems consisting of multiple distributed radar transmitters and receivers to improve resolution and the ability to recognise objects. yet there is a significant challenge in forming focused, useful images due to multiple scattering effects through walls, whereas standard sar imaging has an inherent single scattering assumption. this may be exacerbated with multi-static collections, since different scattering events will be observed from each angle and the data may not coherently combine well in a naive manner. to overcome this, we propose an image formation method which resolves full-wave effects through an approximately known wall or other arbitrary obstacle, which itself has some unknown ""nuisance"" parameters that are determined as part of the reconstruction to provide well focused images. the method is more flexible and realistic than existing methods which treat a single wall as a flat layered medium, whilst being significantly computationally cheaper than full-wave methods, strongly motivated by practical considerations for through-wall sar.",2024-03-15
"goodness-of-fit for conditional distributions: an approach using principal component analysis and component selection","cui rui, li yuhao","econometrics","this paper introduces a novel goodness-of-fit test technique for parametric conditional distributions. the proposed tests are based on a residual marked empirical process, for which we develop a conditional principal component analysis. the obtained components provide a basis for various types of new tests in addition to the omnibus one. component tests that based on each component serve as experts in detecting certain directions. smooth tests that assemble a few components are also of great use in practice. to further improve testing efficiency, we introduce a component selection approach, aiming to identify the most contributory components. the finite sample performance of the proposed tests is illustrated through monte carlo experiments.",2024-03-15
"on the product of periodic distributions. product in shift-invariant spaces","aleksandar aksentijević, suzana aleksić, stevan pilipović","functional analysis","we connect through the fourier transform shift-invariant sobolev type spaces $v_s\subset h^s$, $s\in\mathbb r,$ and the spaces of periodic distributions and analyze the properties of elements in such spaces with respect to the product. if the series expansions of two periodic distributions have compatible coefficient estimates, then their product is a periodic tempered distribution. we connect product of tempered distributions with the product of shift-invariant elements of $v_s$. the idea for the analysis of products comes from the hörmander's description of the sobolev type wave front in connection with the product of distributions. coefficient compatibility for the product of $f$ and $g$ in the case of ""good"" position of their sobolev type wave fronts is proved in the 2-dimensional case. for larger dimension it is an open problem because of the difficulties on the description of the intersection of cones in dimension $d\geqslant3$.",2024-03-15
"bi-lagrangian structures and the space of rays","wojciech domitrz, marcin zubilewicz","differential geometry","this paper focuses on local curvature invariants associated with bi-lagrangian structures. we establish several geometric conditions that determine when the canonical connection is flat, building on our previous findings regarding divergence-free webs. addressing questions raised by tabachnikov, we provide complete solutions to two problems: the existence of flat bi-lagrangian structures within the space of rays induced by a pair of hypersurfaces, and the existence of flat bi-lagrangian structures induced by tangents to lagrangian curves in the symplectic plane.",2024-03-15
"multi-source localization and data association for time-difference of arrival measurements","gabrielle flood, filip elvander","signal processing","in this work, we consider the problem of localizing multiple signal sources based on time-difference of arrival (tdoa) measurements. in the blind setting, in which the source signals are not known, the localization task is challenging due to the data association problem. that is, it is not known which of the tdoa measurements correspond to the same source. herein, we propose to perform joint localization and data association by means of an optimal transport formulation. the method operates by finding optimal groupings of tdoa measurements and associating these with candidate source locations. to allow for computationally feasible localization in three-dimensional space, an efficient set of candidate locations is constructed using a minimal multilateration solver based on minimal sets of receiver pairs. in numerical simulations, we demonstrate that the proposed method is robust both to measurement noise and tdoa detection errors. furthermore, it is shown that the data association provided by the proposed method allows for statistically efficient estimates of the source locations.",2024-03-15
"data-driven cold starting of good reservoirs","lyudmila grigoryeva, boumediene hamzi, felix p. kemeth, yannis kevrekidis, g manjunath, juan-pablo ortega, matthys j. steynberg","dynamical systems","using short histories of observations from a dynamical system, a workflow for the post-training initialization of reservoir computing systems is described. this strategy is called cold-starting, and it is based on a map called the starting map, which is determined by an appropriately short history of observations that maps to a unique initial condition in the reservoir space. the time series generated by the reservoir system using that initial state can be used to run the system in autonomous mode, to produce accurate forecasts of the time series under consideration immediately. by utilizing this map, the lengthy ""washouts"" that are necessary to initialize reservoir systems can be eliminated, enabling the generation of forecasts using any selection of appropriately short histories of the observations.",2024-03-15
"multifractal scaling and the euler equations on r^3/z^3","henrik ueberschaer","analysis of pdes","we study the euler equations describing the motion of an incompressible fluid on the cubic torus with real initial data. we construct solutions on the fourier side which display a sudden loss of regularity within finite time even for highly regular initial data. moreover, the solution may regain its initial regularity within finite time. this loss of regularity may coincide with the appearance of a certain type of multifractal scaling of the solutions.",2024-03-15
"hunter's positivity theorem and random vector norms","ludovick bouthat, ángel chávez, stephan ramon garcia","functional analysis","a theorem of hunter ensures that the complete homogeneous symmetric polynomials of even degree are positive definite functions. a probabilistic interpretation of hunter's theorem suggests a broad generalization: the construction of so-called random vector norms on square complex matrices. this paper surveys these ideas, starting from the fundamental notions and developing the theory to its present state. we study numerous examples and present a host of open problems.",2024-03-15
"a canonical tree decomposition for order types, and some applications","mathilde bouvel, valentin féray, xavier goaoc, florent koechlin","computational geometry","we introduce and study a notion of decomposition of planar point sets (or rather of their chirotopes) as trees decorated by smaller chirotopes. this decomposition is based on the concept of mutually avoiding sets (which we rephrase as \emph{modules}), and adapts in some sense the modular decomposition of graphs in the world of chirotopes. the associated tree always exists and is unique up to some appropriate constraints. we also show how to compute the number of triangulations of a chirotope efficiently, starting from its tree and the (weighted) numbers of triangulations of its parts.",2024-03-15
"supplement matrix and a practical method for computing eigenvalues of a dual hermitian matrix","liqun qi, chunfeng cui","numerical analysis","we study dual number symmetric matrices, dual complex hermitian matrices and dual quaternion hermitian matrices in a unified frame of dual hermitian matrices. suppose we have a ring, which can be the real field, the complex field, or the quaternion ring. then an $n \times n$ dual hermitian matrix has $n$ dual number eigenvalues. we define supplement matrices for a dual hermitian matrix. supplement matrices are hermitian matrices in the original ring. the standard parts of the eigenvalues of that dual hermitian matrix are the eigenvalues of the standard part hermitian matrix in the original ring, while the dual parts of the eigenvalues of that dual hermitian matrix are the eigenvalues of those {supplement} matrices. hence, by apply any practical method for computing eigenvalues of hermitian matrices in the original ring, we have a practical method for computing eigenvalues of a dual hermitian matrix. we call this method the supplement matrix method. applications to low rank approximation and generalized inverses of dual matrices, dual least squares problem and formation control are discussed. numerical experiments are reported.",2024-03-15
"a general non-strict finsler's lemma","t.j. meijer, k.j.a. scheres, s. van den eijnden, t. holicki, c.w. scherer, w.p.m.h. heemels","optimization and control","in this paper, we present a general non-strict finsler's lemma. this result is general in the sense that it does not impose any restrictions on the involved matrices and, thereby, is more broadly applicable than existing non-strict versions of finsler's lemma that do impose such restrictions. in fact, we show that this new non-strict formulation generalizes both the original strict finsler's lemma as well as an existing non-strict version. to further illustrate its usefulness, we showcase applications of the non-strict finsler's lemma in deriving a closed-form solution to the non-strict projection lemma, and a matrix finsler's lemma, which is useful for data-driven control.",2024-03-15
"the reliability of the gender implicit association test (giat) for high-ability careers","s. stanley young, warren b. kindzierski","applications","males outnumber females in many high ability careers, for example, in the fields of science, technology, engineering, and mathematics and professors in academic medicine. these differences are often attributed to implicit, subconscious, bias. one objective of this study was to use statistical p value plots to independently test the ability to support the claim of implicit bias made in a meta analysis of gender bias studies. the meta analysis examined correlations between implicit bias measures based on the gender implicit association test, g iat, and measures of intergroup, female and male, behavior. a second objective was to investigate general intelligence g and vocational, things people, interests as explanatory factors for gender differences in high ability careers. the p value plots constructed using data sets from the meta analysis did not support real associations between the tested variables. these findings reinforce the lack of correlation between g iat, implicit bias, measures and real world gender behaviors in high ability careers. more demanding careers, attorneys, engineers, scientists, corporate executives, are recruited from people with higher g. one is dealing with gender groups and the group of high g females is smaller than high g males. regarding vocational interests, females prefer working with people and males prefer working with things. stem fields are typically things oriented. one is dealing with gender groups and the group of females who prefer working with things is smaller than the group of males. these facts make it predictable that there are more males in high complexity, things careers, stem, academic medicine positions, than females. implicit bias giat measures have little or no explanatory power for gender differences in high ability careers relative to g and interests in working with things.",2024-03-15
