"title","author","subject","abstract","date"
"packing the largest trees in the tree packing conjecture","barnabás janzer, richard montgomery","combinatorics","the famous tree packing conjecture of gyárfás from 1976 says that any sequence of trees $t_1,\ldots,t_n$ such that $|t_i|=i$ for each $i\in [n]$ packs into the complete $n$-vertex graph $k_n$. packing even just the largest trees in such a sequence has proven difficult, with bollobás drawing attention to this in 1995 by conjecturing that, for each $k$, if $n$ is sufficiently large then the largest $k$ trees in any such sequence can be packed into $k_n$. this has only been shown for $k\leq 5$, by żak, despite many partial results and much related work on the full tree packing conjecture. we prove bollobás's conjecture, by showing that, moreover, a linear number of the largest trees can be packed in the tree packing conjecture.",2024-03-15
"on the frame property of hermite functions and analytic extensions of their frame sets","markus faulhuber, irina shafkulovska, ilya zlotnikov","functional analysis","we study gabor frames with hermite window functions. gröchenig and lyubarskii provided a sufficient density condition for their frame sets, which leads to what we call the ``safety region"". for rectangular lattices and hermite windows of order 4 and higher, we enlarge this safety region by providing new points on the boundary of this region. for this purpose, we employ the janssen representation of the frame operator to compare its distance to the identity in the operator norm. the calculations lead to estimates on series involving laguerre polynomials with gaussian weight functions.",2024-03-15
"a lozenge triangulation of the plane with integers","raghavendra n. bhat, cristian cobeli, alexandru zaharescu","number theory","we introduce and study a three-folded linear operator depending on three parameters that has associated a triangular number tilling of the plane. as a result the set of all triples of integers is decomposed in classes of equivalence organized in four towers of two-dimensional triangulations. we provide the full characterization of the represented integers belonging to each network as families of certain quadratic forms. we note that one of the towers is generated by a germ that produces a covering of the plane with {löschian} numbers.",2024-03-15
"data-driven distributionally robust safety verification using barrier certificates and conditional mean embeddings","oliver schön, zhengang zhong, sadegh soudjani","systems and control","algorithmic verification of realistic systems to satisfy safety and other temporal requirements has suffered from poor scalability of the employed formal approaches. to design systems with rigorous guarantees, many approaches still rely on exact models of the underlying systems. since this assumption can rarely be met in practice, models have to be inferred from measurement data or are bypassed completely. whilst former usually requires the model structure to be known a-priori and immense amounts of data to be available, latter gives rise to a plethora of restrictive mathematical assumptions about the unknown dynamics. in a pursuit of developing scalable formal verification algorithms without shifting the problem to unrealistic assumptions, we employ the concept of barrier certificates, which can guarantee safety of the system, and learn the certificate directly from a compact set of system trajectories. we use conditional mean embeddings to embed data from the system into a reproducing kernel hilbert space (rkhs) and construct an rkhs ambiguity set that can be inflated to robustify the result w.r.t. a set of plausible transition kernels. we show how to solve the resulting program efficiently using sum-of-squares optimization and a gaussian process envelope. our approach lifts the need for restrictive assumptions on the system dynamics and uncertainty, and suggests an improvement in the sample complexity of verifying the safety of a system on a tested case study compared to a state-of-the-art approach.",2024-03-15
"the inhomogeneous $t$-pushtasep and macdonald polynomials","arvind ayyer, james martin, lauren williams","combinatorics","we study a multispecies $t$-pushtasep system on a finite ring of $n$ sites with site-dependent rates $x_1,\dots,x_n$. let $\lambda=(\lambda_1,\dots,\lambda_n)$ be a partition whose parts represent the species of the $n$ particles on the ring. we show that for each composition $\eta$ obtained by permuting the parts of $\lambda$, the stationary probability of being in state $\eta$ is proportional to the asep polynomial $f_{\eta}(x_1,\dots,x_n; q,t)$ at $q=1$; the normalizing constant (or partition function) is the macdonald polynomial $p_{\lambda}(x_1,\dots,x_n;q,t)$ at $q=1$. our approach involves new relations between the families of asep polynomials and of non-symmetric macdonald polynomials at $q=1$. we also use multiline diagrams, showing that a single jump of the pushtasep system is closely related to the operation of moving from one line to the next in a multiline diagram. we derive symmetry properties for the system under permutation of its jump rates, as well as a formula for the current of a single-species system.",2024-03-15
"central limit theorems for the derivatives of self-intersection local time for $d$-dimensional brownian motion","xiaoyan xu, xianye yu","probability","let $\{b_t,t\geq0\}$ be a d-dimensional brownian motion. we prove that the approximation of the higher derivative of renormalized self-intersection local time $$ \int_{0}^{1}\int_{0}^{s}\left(p^{(|k|)}_{d,\epsilon}(b_{s}-b_{r})-e[p^{(|k|)}_{d,\epsilon}(b_{s}-b_{r})]\right)drds, $$ where the multiindex $k=(k_{1},\cdots,k_{d})$, $ p_{d,\epsilon}^{(|k|)}(x_1,x_2,\cdots,x_d):=\partial^{k_1}_{x_1}\partial^{k_2}_{x_2}$ $\cdots\partial^{k_d}_{x_d}p_{d,\epsilon}(x_1,x_2,\cdots,x_d)$ and $p_{d,\epsilon}(x)=\frac{1}{(2\pi\epsilon)^{d/2}}e^{-\frac{|x|^{2}}{2\epsilon}}, x\in\mathbb{r}^d$, satisfies the central limit theorems when renormalized by $(\log\frac{1}{\epsilon})^{-1}$ in the case $d=2$, $|k|=1$ and by $\epsilon^{\frac{d+|k|-3}{2}}$ in the case $d\geq 3$, $|k|\geq 1$, which gives a complete answer to the conjecture of markowsky [in séminaire de probabilitiés \uppercase\expandafter{\romannumeral10\romannumeral50\romannumeral4} (2012) 141-148 springer]. we as well prove that its m-th wiener chaotic component satisfies the central limit theorems when renormalized by a multiplicative factor in different cases.",2024-03-15
"can a gpt4-powered ai agent be a good enough performance attribution analyst?","bruno de melo","computational finance","performance attribution analysis, defined as the process of explaining the drivers of the excess performance of an investment portfolio against a benchmark, stands as a significant aspect of portfolio management and plays a crucial role in the investment decision-making process, particularly within the fund management industry. rooted in a solid financial and mathematical framework, the importance and methodologies of this analytical technique are extensively documented across numerous academic research papers and books. the integration of large language models (llms) and ai agents marks a groundbreaking development in this field. these agents are designed to automate and enhance the performance attribution analysis by accurately calculating and analyzing portfolio performances against benchmarks. in this study, we introduce the application of an ai agent for a variety of essential performance attribution tasks, including the analysis of performance drivers and utilizing llms as calculation engine for multi-level attribution analysis and question-answer (qa) exercises. leveraging advanced prompt engineering techniques such as chain-of-thought (cot) and plan and solve (ps), and employing a standard agent framework from langchain, the research achieves promising results: it achieves accuracy rates exceeding 93% in analyzing performance drivers, attains 100% in multi-level attribution calculations, and surpasses 84% accuracy in qa exercises that simulate official examination standards. these findings affirm the impactful role of ai agents, prompt engineering and evaluation in advancing portfolio management processes, highlighting a significant advancement in the practical application and evaluation of ai technologies within the domain.",2024-03-15
"lower bounds for kernel density estimation on symmetric spaces","dena marie asta","statistics theory","we prove that kernel density estimation on symmetric spaces of non-compact type, whose l2-risk was bounded above in previous work (asta,2021), in fact achieves a minimax rate of convergence. with this result, the story for kernel density estimation on all symmetric spaces is completed. the idea in adapting the proof for euclidean space is to suitably abstract vector space operations on euclidean space to both actions of symmetric groups and reparametrizations of helgason-fourier transforms and to use the fact that the exponential map for symmetric spaces of non-compact type defines a diffeomorphism.",2024-03-15
"complete equational theories for classical and quantum gaussian relations","robert i. booth, titouan carette, cole comfort","logic in computer science","we give generators and relations for the hypergraph props of gaussian relations and positive affine lagrangian relations. the former extends gaussian probabilistic processes by completely-uninformative priors, and the latter extends gaussian quantum mechanics with infinitely-squeezed states. these presentations are given by adding a generator to the presentation of real affine relations and of real affine lagrangian relations which freely codiscards effects, as well as certain rotations. the presentation of positive affine lagrangian relations provides a rigorous justification for many common yet informal calculations in the quantum physics literature involving infinite-squeezing. our presentation naturally extends menicucci et al.'s graph-theoretic representation of gaussian quantum states with a representation for gaussian transformations. we interpret the lov-calculus, a diagrammatic calculus for reasoning about passive linear-optical quantum circuits in our presentation of positive affine lagrangian relations. moreover, we show how our presentation allows for additional optical operations such as active squeezing.",2024-03-15
"new functional inequalities with applications to the arctan-fast diffusion equation","rafael granero-belinchón, martina magliocca, alejandro ortega","analysis of pdes","in this paper, we prove a couple of new nonlinear functional inequalities of sobolev type akin to the logarithmic sobolev inequality. in particular, one of the inequalities reads $$ \int_{\mathbb{s}^1}\arctan\left(\frac{\partial_x u}{u}\right)\partial_xu \,dx\geq \arctan\left(\|u(t)\|_{\dot{w}^{1,1}(\mathbb{s}^1)}\right)\|u(t)\|_{\dot{w}^{1,1}(\mathbb{s}^1)}. $$ then, these inequalities are used in the study of the nonlinear \emph{arctan}-fast diffusion equation $$ \partial_t u-\partial_x\arctan\left(\frac{\partial_x u}{u}\right)=0. $$ for this highly nonlinear pde we establish a number of well-posedness results and qualitative properties.",2024-03-15
"stochastic integration with respect to cylindrical lévy processes in hilbert spaces","gergely bodó, markus riedle","probability","in this work, we present a comprehensive theory of stochastic integration with respect to arbitrary cylindrical lévy processes in hilbert spaces. since cylindrical lévy processes do not enjoy a semi-martingale decomposition, our approach relies on an alternative approach to stochastic integration by decoupled tangent sequences. the space of deterministic integrands is identified as a modular space described in terms of the characteristics of the cylindrical lévy process. the space of random integrands is described as the space of predictable processes whose trajectories are in the space of deterministic integrands almost surely. the derived space of random integrands is verified as the largest space of potential integrands, based on a classical definition of stochastic integrability. we apply the introduced theory of stochastic integration to establish a dominated convergence theorem.",2024-03-15
"stationary non-radial localized patterns in the planar swift-hohenberg pde: constructive proofs of existence","matthieu cadiot, jean-philippe lessard, jean-christophe nave","analysis of pdes","in this paper, we present a methodology for establishing constructive proofs of existence of smooth, stationary, non-radial localized patterns in the planar swift-hohenberg equation. specifically, given an approximate solution $u_0$, we construct an approximate inverse for the linearization around $u_0$, enabling the development of a newton-kantorovich approach. consequently, we derive a sufficient condition for the existence of a unique localized pattern in the vicinity of $u_0$. the verification of this condition is facilitated through a combination of analytic techniques and rigorous numerical computations. moreover, an additional condition is derived, establishing that the localized pattern serves as the limit of a family of periodic solutions (in space) as the period tends to infinity. the integration of analytical tools and meticulous numerical analysis ensures a comprehensive validation of this condition. to illustrate the efficacy of the proposed methodology, we present computer-assisted proofs for the existence of three distinct unbounded branches of periodic solutions in the planar swift-hohenberg equation, all converging towards a localized planar pattern, whose existence is also proven constructively. all computer-assisted proofs, including the requisite codes, are accessible on github at \cite{julia_cadiot}.",2024-03-15
"excluding cosmetic surgeries on hyperbolic 3-manifolds","david futer, jessica s. purcell, saul schleimer","geometric topology","this paper employs knot invariants and results from hyperbolic geometry to develop a practical procedure for checking the cosmetic surgery conjecture on any given one-cusped manifold. this procedure has been used to establish the following computational results. first, we verify that all knots up to 19 crossings, and all one-cusped 3-manifolds in the snappy census, do not admit any purely cosmetic surgeries. second, we check that a hyperbolic knot with at most 15 crossings only admits chirally cosmetic surgeries when the knot itself is amphicheiral. third, we enumerate all knots up to 13 crossings that share a common dehn fillings with the figure-8 knot. the code that verifies these results is publicly available on github.",2024-03-15
"free doubly-infinitary distributive categories are cartesian closed","fernando lucatelli nunes, matthijs vákár","category theory","we delve into the concept of categories with products that distribute over coproducts, which we call doubly-infinitary distributive categories. we show various instances of doubly-infinitary distributive categories aiming for a comparative analysis with established notions such as extensivity, infinitary distributiveness, and cartesian closedness. our exploration reveals that this condition represents a substantial extension beyond the classical understanding of infinitary distributive categories. our main theorem establishes that free doubly-infinitary distributive categories are cartesian closed. we end the paper with remarks on non-canonical isomorphisms, open questions, and future work.",2024-03-15
"boundedness properties of modified averaging operators","j. m. aldaz, a. caldera","functional analysis","we study certain boundedness properties of modified averaging operators, showing that on geometrically doubling spaces superaveraging operators are always $l^1$-bounded (but not necessarily $l^p$-bounded for $p > 1$). in turn, the $l^1$ boundedness of the superaveraging operators for any $t > 1$, entails that the space is geometrically doubling.",2024-03-15
"a mean-field game of market entry: portfolio liquidation with trading constraints","guanxing fu, paul p. hager, ulrich horst","mathematical finance","we consider both $n$-player and mean-field games of optimal portfolio liquidation in which the players are not allowed to change the direction of trading. players with an initially short position of stocks are only allowed to buy while players with an initially long position are only allowed to sell the stock. under suitable conditions on the model parameters we show that the games are equivalent to games of timing where the players need to determine the optimal times of market entry and exit. we identify the equilibrium entry and exit times and prove that equilibrium mean-trading rates can be characterized in terms of the solutions to a highly non-linear higher-order integral equation with endogenous terminal condition. we prove the existence of a unique solution to the integral equation from which we obtain the existence of a unique equilibrium both in the mean-field and the $n$-player game.",2024-03-15
"boundedness of some convolution-type operators on metric measure spaces","j. m. aldaz","functional analysis","we explore boundedness properties in the context of metric measure spaces, of some natural operators of convolution type whose study is suggested by certain transformations used in computer vision.",2024-03-15
"model free collision aggregation for the computation of escape distributions","laetitia laguzet, gabriel turinici","computational physics","motivated by a heat radiative transport equation, we consider a particle undergoing collisions in a space-time domain and propose a method to sample its escape time, space and direction from the domain. the first step of the procedure is an estimation of how many elementary collisions is safe to take before chances of exiting the domain are too high; then these collisions are aggregated into a single movement. the method does not use any model nor any particular regime of parameters. we give theoretical results both under the normal approximation and without it and test the method on some benchmarks from the literature. the results confirm the theoretical predictions and show that the proposal is an efficient method to sample the escape distribution of the particle.",2024-03-15
"construction of arithmetic teichmuller spaces iv: proof of the abc-conjecture","kirti joshi","algebraic geometry","this is a continuation of my work on arithmetic teichmuller spaces developed in the present series of papers. in this paper, i show that the theory of arithmetic teichmuller spaces leads, using shinichi mochizuki's rubric, to a proof of the $abc$-conjecture (as asserted by mochizuki).",2024-03-15
"convergence and trade-offs in riemannian gradient descent and riemannian proximal point","david martínez-rubio, christophe roux, sebastian pokutta","optimization and control","in this work, we analyze two of the most fundamental algorithms in geodesically convex optimization: riemannian gradient descent and (possibly inexact) riemannian proximal point. we quantify their rates of convergence and produce different variants with several trade-offs. crucially, we show the iterates naturally stay in a ball around an optimizer, of radius depending on the initial distance and, in some cases, on the curvature. in contrast, except for limited cases, previous works bounded the maximum distance between iterates and an optimizer only by assumption, leading to incomplete analyses and unquantified rates. we also provide an implementable inexact proximal point algorithm yielding new results on minmax problems, and we prove several new useful properties of riemannian proximal methods: they work when positive curvature is present, the proximal operator does not move points away from any optimizer, and we quantify the smoothness of its induced moreau envelope. further, we explore beyond our theory with empirical tests.",2024-03-15
"structured evaluation of synthetic tabular data","scott cheng-hsin yang, baxter eaves, michael schmidt, ken swanson, patrick shafto","machine learning","tabular data is common yet typically incomplete, small in volume, and access-restricted due to privacy concerns. synthetic data generation offers potential solutions. many metrics exist for evaluating the quality of synthetic tabular data; however, we lack an objective, coherent interpretation of the many metrics. to address this issue, we propose an evaluation framework with a single, mathematical objective that posits that the synthetic data should be drawn from the same distribution as the observed data. through various structural decomposition of the objective, this framework allows us to reason for the first time the completeness of any set of metrics, as well as unifies existing metrics, including those that stem from fidelity considerations, downstream application, and model-based approaches. moreover, the framework motivates model-free baselines and a new spectrum of metrics. we evaluate structurally informed synthesizers and synthesizers powered by deep learning. using our structured framework, we show that synthetic data generators that explicitly represent tabular structure outperform other methods, especially on smaller datasets.",2024-03-15
"quantization avoids saddle points in distributed optimization","yanan bo, yongqiang wang","optimization and control","distributed nonconvex optimization underpins key functionalities of numerous distributed systems, ranging from power systems, smart buildings, cooperative robots, vehicle networks to sensor networks. recently, it has also merged as a promising solution to handle the enormous growth in data and model sizes in deep learning. a fundamental problem in distributed nonconvex optimization is avoiding convergence to saddle points, which significantly degrade optimization accuracy. we discover that the process of quantization, which is necessary for all digital communications, can be exploited to enable saddle-point avoidance. more specifically, we propose a stochastic quantization scheme and prove that it can effectively escape saddle points and ensure convergence to a second-order stationary point in distributed nonconvex optimization. with an easily adjustable quantization granularity, the approach allows a user to control the number of bits sent per iteration and, hence, to aggressively reduce the communication overhead. numerical experimental results using distributed optimization and learning problems on benchmark datasets confirm the effectiveness of the approach.",2024-03-15
"fischer decompositions for entire functions of sufficiently low order","j. m. aldaz, h. render","analysis of pdes","the existence of decompositions of the form $f=p\cdot q+r$ with $p_k^{\ast}\left( d\right) r=0 $, where $f$ is entire, $p$ a polynomial and $p^{\ast}_k$ the principal part of $p$ with its coefficients conjugated, was achieved in \cite{alre23} under certain restrictions on the order of $f$. here we prove uniqueness, thereby obtaining fischer decompositions, under conditions that sometimes match those required for existence, and sometimes are more restrictive, depending on the parameters involved.",2024-03-15
"robust sparse estimation for gaussians with optimal error under huber contamination","ilias diakonikolas, daniel m. kane, sushrut karmalkar, ankit pensia, thanasis pittas","machine learning","we study gaussian sparse estimation tasks in huber's contamination model with a focus on mean estimation, pca, and linear regression. for each of these tasks, we give the first sample and computationally efficient robust estimators with optimal error guarantees, within constant factors. all prior efficient algorithms for these tasks incur quantitatively suboptimal error. concretely, for gaussian robust $k$-sparse mean estimation on $\mathbb{r}^d$ with corruption rate $\epsilon>0$, our algorithm has sample complexity $(k^2/\epsilon^2)\mathrm{polylog}(d/\epsilon)$, runs in sample polynomial time, and approximates the target mean within $\ell_2$-error $o(\epsilon)$. previous efficient algorithms inherently incur error $\omega(\epsilon \sqrt{\log(1/\epsilon)})$. at the technical level, we develop a novel multidimensional filtering method in the sparse regime that may find other applications.",2024-03-15
