"title","author","subject","abstract","date"
"boundary parameter matching for isogeometric analysis using schwarz-christoffel mapping","ye ji, matthias möller, yingying yu, chungang zhu","numerical analysis","isogeometric analysis has brought a paradigm shift in integrating computational simulations with geometric designs across engineering disciplines. this technique necessitates analysis-suitable parameterization of physical domains to fully harness the synergy between computer-aided design and computer-aided engineering analyses. the existing methods often fix boundary parameters, leading to challenges in elongated geometries such as fluid channels and tubular reactors. this paper presents an innovative solution for the boundary parameter matching problem, specifically designed for analysis-suitable parameterizations. we employ a sophisticated schwarz-christoffel mapping technique, which is instrumental in computing boundary correspondences. a refined boundary curve reparameterization process complements this. our dual-strategy approach maintains the geometric exactness and continuity of input physical domains, overcoming limitations often encountered with the existing reparameterization techniques. by employing our proposed boundary parameter method, we show that even a simple linear interpolation approach can effectively construct a satisfactory analysis-suitable parameterization. our methodology offers significant improvements over traditional practices, enabling the generation of analysis-suitable and geometrically precise models, which is crucial for ensuring accurate simulation results. numerical experiments show the capacity of the proposed method to enhance the quality and reliability of isogeometric analysis workflows.",2024-03-15
"optimal control of stationary doubly diffusive flows on two and three dimensional bounded lipschitz domains: numerical analysis","jai tushar, arbaz khan, manil t. mohan","numerical analysis","in this work, we propose fully nonconforming, locally exactly divergence-free discretizations based on lowest order crouziex-raviart finite element and piecewise constant spaces to study the optimal control of stationary double diffusion model presented in [bürger, méndez, ruiz-baier, sinum (2019), 57:1318-1343]. the well-posedness of the discrete uncontrolled state and adjoint equations are discussed using discrete lifting and fixed point arguments, and convergence results are derived rigorously under minimal regularity. building upon our recent work [tushar, khan, mohan arxiv (2023)], we prove the local optimality of a reference control using second-order sufficient optimality condition for the control problem, and use it along with an optimize-then-discretize approach to prove optimal order a priori error estimates for the control, state and adjoint variables upto the regularity of the solution. the optimal control is computed using a primal-dual active set strategy as a semi-smooth newton method and computational tests validate the predicted error decay rates and illustrate the proposed scheme's applicability to optimal control of thermohaline circulation problems.",2024-03-15
"almost sure otm-realizability","merlin carl","logic","combining the approaches made in works with galeotti and passmann, we define and study a notion of ""almost sure"" realizability with parameter-free ordinal turing machines (otms). in particular, we show that, in contrast to the classical case, almost sure realizability differs from plain realizability, while closure under intuitionistic predicate logic and realizability of kripke-platek set theory continue to hold.",2024-03-15
"topological noetherianity of the infinite half-spin representations","christopher chiu, jan draisma, rob eggermont, tim seynnaeve, nafie tairi","algebraic geometry","we prove that the infinite half-spin representations are topologically noetherian with respect to the infinite spin group. as a consequence we obtain that half-spin varieties, which we introduce, are defined by the pullback of equations at a finite level. the main example for such varieties is the infinite isotropic grassmannian in its spinor embedding, for which we explicitly determine its defining equations.",2024-03-15
"discrete functional inequalities on lattice graphs","shubham gupta","functional analysis","in this thesis, we study problems at the interface of analysis and discrete mathematics. we discuss analogues of well known hardy-type inequalities and rearrangement inequalities on the lattice graphs $\mathbb{z}^d$, with a particular focus on behaviour of sharp constants and this http url the first half of the thesis, we analyse hardy inequalities on $\mathbb{z}^d$, first for $d=1$ and then for $d \geq 3$. we prove a sharp weighted hardy inequality on integers with power weights of the form $n^\alpha$. this is done via two different methods, namely super-solution and fourier method. we also use fourier method to prove a weighted hardy type inequality for higher order operators. after discussing the one dimensional case, we study the hardy inequality in higher dimensions ($d \geq 3$). in particular, we compute the asymptotic behaviour of the sharp constant in the discrete hardy inequality, as $d \rightarrow \infty$. this is done by converting the inequality into a continuous hardy-type inequality on a torus for functions having zero average. these continuous inequalities are new and interesting in themselves. in the second half, we focus our attention on analogues of rearrangement inequalities on lattice graphs. we begin by analysing the situation in dimension one. we define various notions of rearrangements and prove the corresponding polya-szegő inequality. these inequalities are also applied to prove some weighted hardy inequalities on integers. finally, we study rearrangement inequalities (polya-szegő) on general graphs, with a particular focus on lattice graphs $\mathbb{z}^d$, for $d \geq 2$. we develop a framework to study these inequalities, using which we derive concrete results in dimension two. in particular, these results develop connections between polya-szegő inequality and various isoperimetric inequalities on graphs.",2024-03-15
"moduli spaces of quadratic differentials: abel-jacobi map and deformation","yu qiu","geometric topology","we study the moduli space of quadratic differentials with prescribed singularities parameterized by a decorated marked surface with punctures (dmsp), where simple zeros, double poles and higher order poles respectively correspond to decorations, punctures and boundary components. we show that the fundamental group of this space equals the kernel of the abel-jacobi map from the mapping class group of dmsp to the first homology group of the marked surface (without decorations/punctures). moreover, a universal cover of this space is given by the space of stability conditions on the associated 3-calabi-yau category. furthermore, when we partial compactify (and orbifold) the moduli space by allowing the collision of simple zeros and some of the double poles, the resulting moduli space is isomorphic to a quotient of the space of stability conditions on the deformed (with respect to those collidable double poles) 3-calabi-yau category.",2024-03-15
"structural preprocessing method for nonlinear differential-algebraic equations using linear symbolic matrices","taihei oki, yujin song","symbolic computation","differential-algebraic equations (daes) have been used in modeling various dynamical systems in science and engineering. several preprocessing methods for daes, such as consistent initialization and index reduction, use structural information on daes. unfortunately, these methods may fail when the system jacobian, which is a functional matrix, derived from the dae is singular. to transform a dae with a singular system jacobian into a nonsingular system, several regularization methods have been proposed. most of all existing regularization methods rely on symbolic computation to eliminate the system jacobian for finding a certificate of singularity, resulting in much computational time. iwata--oki--takamatsu (2019) proposed a method (iot-method) to find a certificate without symbolic computations. the iot method approximates the system jacobian by a simpler symbolic matrix, called a layered mixed matrix, which admits a fast combinatorial algorithm for singularity testing. however, it often overlooks the singularity of the system jacobian since the approximation largely discards algebraic relationships among entries in the original system jacobian. in this study, we propose a new regularization method extending the idea of the iot method. instead of layered mixed matrices, our method approximates the system jacobian by more expressive symbolic matrices, called rank-1 coefficient mixed (1cm) matrices. this makes our method more widely applicable. we give a fast combinatorial algorithm for finding a singularity certificate of 1cm-matrices, which is free from symbolic elimination. our method is also advantageous in that it globally preserves the solution set to the dae. through numerical experiments, we confirmed that our method runs fast for large-scale daes from real instances.",2024-03-15
"interpretable machine learning for survival analysis","sophie hanna langbein, mateusz krzyziński, mikołaj spytek, hubert baniecki, przemysław biecek, marvin n. wright","machine learning","with the spread and rapid advancement of black box machine learning models, the field of interpretable machine learning (iml) or explainable artificial intelligence (xai) has become increasingly important over the last decade. this is particularly relevant for survival analysis, where the adoption of iml techniques promotes transparency, accountability and fairness in sensitive areas, such as clinical decision making processes, the development of targeted therapies, interventions or in other medical or healthcare related contexts. more specifically, explainability can uncover a survival model's potential biases and limitations and provide more mathematically sound ways to understand how and which features are influential for prediction or constitute risk factors. however, the lack of readily available iml methods may have deterred medical practitioners and policy makers in public health from leveraging the full potential of machine learning for predicting time-to-event data. we present a comprehensive review of the limited existing amount of work on iml methods for survival analysis within the context of the general iml taxonomy. in addition, we formally detail how commonly used iml methods, such as such as individual conditional expectation (ice), partial dependence plots (pdp), accumulated local effects (ale), different feature importance measures or friedman's h-interaction statistics can be adapted to survival outcomes. an application of several iml methods to real data on data on under-5 year mortality of ghanaian children from the demographic and health surveys (dhs) program serves as a tutorial or guide for researchers, on how to utilize the techniques in practice to facilitate understanding of model decisions or predictions.",2024-03-15
"proper splittings of hilbert space operators","guillermina fongi, maría celeste gonzalez","functional analysis","proper splittings of operators are commonly used to study the convergence of iterative processes. in order to approximate solutions of operator equations, in this article we deal with proper splittings of closed range bounded linear operators defined on hilbert spaces. we study the convergence of general proper splittings of operators in the infinite dimensional context. we also propose some particular splittings for special classes of operators and we study different criteria of convergence and comparison for them. in some cases, these criteria are given under hypothesis of operator order relations. in addition, we relate these results with the concept of the symmetric approximation of a frame in a hilbert space.",2024-03-15
"convergence rates for tikhonov regularization of coefficient identification problems in robin-boundary equation","huimin huang, wensheng zhang","analysis of pdes","this paper investigates the convergence rate for tikhonov regularization of the problem of identifying the coefficient $a \in l^{\infty}(\omega)$ in the robin-boundary equation $-\mathrm{div}(a\nabla u)-bu=f,~ x \in \omega \subset \mathbb r^m,~ m \geq 1$ and $u=0,~ x ~on~ \partial\omega$, where $f(x)\in l^{\infty}(\omega)$. assume we only know the imprecise values of $u$ in the subset $\omega_1 \subset \omega$ given by $z^{\delta} \in {h}^1(\omega_1)$, satisfies $\|u-z^{\delta}\|_{h^1(\omega_1)}\leq \delta$. we assume $u$ satisfy the following boundary conditions on $\partial\omega_1$: \begin{align*} \nabla u \cdot \vec{n}+\gamma u =0~on~\partial\omega_1, \end{align*} where $\vec{n}$ is the normal vector of $\partial\omega_1$ and $\gamma>0$ is a constant. we regularize this problem by correspondingly minimizing the strictly convex functional: \begin{align*} \min \limits_{a \in \mathbb a} &\frac12 \int_{\omega_1} a | {\nabla(u(a)-z^\delta)}|^2 +\frac12\int_{\partial\omega_1} a\gamma [u(a)-z^\delta]^2-\frac12 \int_{\omega_1} b [u(a)-z^\delta]^2\\ &+ \rho \| a-a^* \|^2_{l^2(\omega)}, \end{align*} where $u(a)$ is a map for $a$ to the solution of the robin-boundary problem, $\rho > 0$ is the regularization parameter and $a^*$ is a priori estimate of $a$. we prove that the functional attain a unique global minimizer on the admissible set. further, we give very simple source condition without the smallness requirement on the source function which provide the convergence rate $o(\sqrt{\delta})$ for the regularized solution.",2024-03-15
"l-functional analysis","eder kikianty, miek messerschmidt, luan naude, mark roelands, christopher schwanke, walt van amstel, jan harm van der walt, marten wortel","functional analysis","inspired by the theories of kaplansky-hilbert modules and probability theory in vector lattices, we generalise functional analysis by replacing the scalars $\mathbb{r}$ or $\mathbb{c}$ by a real or complex dedekind complete unital $f$-algebra $\mathbb{l}$; such an algebra can be represented as a suitable space of continuous functions. we set up the basic theory of $\mathbb{l}$-normed and $\mathbb{l}$-banach spaces and bounded operators between them, we discuss the $\mathbb{l}$-valued analogues of the classical $\ell^p$-spaces, and we prove the analogue of the hahn-banach theorem. we also discuss the basics of the theory of $\mathbb{l}$-hilbert spaces, including projections onto convex subsets and the riesz representation theorem.",2024-03-15
"note on the second derivative of bounded analytic functions","gangqiang chen","complex variables","assume $z_0$ lies in the open unit disk $\mathbb{d}$ and $g$ is an analytic self-map of $\mathbb{d}$. we will determine the region of values of $g''(z_0)$ in terms of $z_0$, $g(z_0)$ and the hyperbolic derivative of $g$ at $z_0$, and give the form of all the extremal functions. in particular, we obtain a smaller sharp upper bound for $|g''(z_0)|$ than ruscheweyh's inequality for the case of the second derivative. moreover, we use a different method to obtain sz{á}sz's inequality, which provides a sharp upper bound for $|g''(z_0)|$ depending only on $|z_0|$.",2024-03-15
"comparison of proximal first-order primal and primal-dual algorithms via performance estimation","nizar bousselmi, nelly pustelnik, julien m. hendrickx, françois glineur","optimization and control","selecting the fastest algorithm for a specific signal/image processing task is a challenging question. we propose an approach based on the performance estimation problem framework that numerically and automatically computes the worst-case performance of a given optimization method on a class of functions. we first propose a computer-assisted analysis and comparison of several first-order primal optimization methods, namely, the gradient method, the forward-backward, peaceman-rachford, and douglas-rachford splittings. we tighten the existing convergence results of these algorithms and extend them to new classes of functions. our analysis is then extended and evaluated in the context of the primal-dual chambolle-pock and condat-vũ methods.",2024-03-15
"the euclidean mst-ratio for bi-colored lattices","sebastiano cultrera di montesano, ondřej draganov, herbert edelsbrunner, morteza saghafian","computational geometry","given a finite set, $a \subseteq \mathbb{r}^2$, and a subset, $b \subseteq a$, the \emph{mst-ratio} is the combined length of the minimum spanning trees of $b$ and $a \setminus b$ divided by the length of the minimum spanning tree of $a$. the question of the supremum, over all sets $a$, of the maximum, over all subsets $b$, is related to the steiner ratio, and we prove this sup-max is between $2.154$ and $2.427$. restricting ourselves to $2$-dimensional lattices, we prove that the sup-max is $2.0$, while the inf-max is $1.25$. by some margin the most difficult of these results is the upper bound for the inf-max, which we prove by showing that the hexagonal lattice cannot have mst-ratio larger than $1.25$.",2024-03-15
"effective polygonal mesh generation and refinement for vem","stefano berrone, fabio vicini","numerical analysis","in the present work we introduce a novel refinement algorithm for two-dimensional elliptic partial differential equations discretized with virtual element method (vem). the algorithm improves the numerical solution accuracy and the mesh quality through a controlled refinement strategy applied to the generic polygonal elements of the domain tessellation. the numerical results show that the outlined strategy proves to be versatile and applicable to any two-dimensional problem where polygonal meshes offer advantages. in particular, we focus on the simulation of flow in fractured media, specifically using the discrete fracture network (dfn) model. a residual a-posteriori error estimator tailored for the dfn case is employed. we chose this particular application to emphasize the effectiveness of the algorithm in handling complex geometries. all the numerical tests demonstrate optimal convergence rates for all the tested vem orders.",2024-03-15
"on the functoriality of refined unramified cohomology","kees kok, lin zhou","algebraic geometry","in this paper, we generalise the construction of the functorial pullback of refined unramified cohomology between smooth schemes, by following the ideas of fulton's intersection theory and rost's cycle modules. we also define standard actions of algebraic cycles on the refined unramified cohomology groups of smooth proper schemes avoiding chow's moving lemma, which coincide with schreieder's constructions for smooth projective schemes. as applications, we prove the projective bundle and blow-up formulas for refined unramified cohomology groups and we reduce the rost nilpotence principle in characteristic zero to a statement concerning certain refined unramified cohomology groups. moreover, we compute the refined unramified cohomology for smooth proper linear varieties and show that rost's nilpotence principle holds for these varieties in characteristic zero.",2024-03-15
"euclidean rectifiability of sub-finsler spheres in free-carnot groups of step 2","enrico le donne, luca nalon","metric geometry","we consider 2-step free-carnot groups equipped with sub-finsler distances. we prove that the metric spheres are codimension-one rectifiable from the euclidean viewpoint. the result is obtained by studying how the lipschitz constant for the distance function behaves near abnormal geodesics.",2024-03-15
"even-odd partition identities of göellnitz-gordon type","pooneh afsharijoo","combinatorics","in this paper, we prove a theorem which adds a new member to the famous göellnitz-gordon identities. we construct a ""new system of recurrence formulas"" in order to prove it.",2024-03-15
"an efficient asymptotic dc method for sparse and low-rank matrix recovery","mingcai ding, xiaoliang song, bo yu","optimization and control","the optimization problem of sparse and low-rank matrix recovery is considered, which involves a least squares problem with a rank constraint and a cardinality constraint. to overcome the challenges posed by these constraints, an asymptotic difference-of-convex (adc) method that employs a moreau smoothing approach and an exact penalty approach is proposed to transform this problem into a dc programming format gradually. to solve the gained dc programming, by making full use of its dc structure, an efficient inexact dc algorithm with sieving strategy (sidca) is introduced. the subproblem of sidca is solved by an efficient dual-based semismooth newton method. the convergence of the solution sequence generated by sidca is proved. to illustrate the effectiveness of adc-sidca, matrix recovery experiments on nonnegative and positive semidefinite matrices. the numerical results are compared with those obtained using a successive dc approximation minimization method and a penalty proximal alternating linearized minimization approach. the outcome of the comparison indicates that adc-sidca surpasses the other two methods in terms of efficiency and recovery error. additionally, numerical experiments on sparse phase retrieval demonstrate that adc-sidca is a valuable tool for recovering sparse and low-rank hermitian matrices.",2024-03-15
"extremal spectral results of planar graphs without $c_{l, l}$ or $\mathrm{theta}$ graph","haoran zhang, wenhuan wang","combinatorics","let $\mathcal {f}$ be a given family of graphs. a graph $g$ is $\mathcal {f}$-free if it does not contain any member of $\mathcal {f}$ as a subgraph. let $c_{l, l}$ be a graph obtained from $2c_l$ such that the two cycles share a common vertex, where $l\geqslant3 $. a $\mathrm{theta}$ graph is obtained from a cycle $c_k$ by adding an additional edge between two non-consecutive vertices on $c_k$, where $k\geqslant 4$. let $\theta_k$ be set of $\mathrm{theta}$ graphs, where $k \geqslant 4$. for sufficiently large $n $, the unique extremal planar graph with the maximum spectral radius among $c_{l, l}$-free planar graphs on $n$ vertices and among $\theta_k$-free planar graphs on $n$ vertices are characterized respectively, where $l \geqslant 3$ and $k \geqslant 4$.",2024-03-15
"generalized zero-divisor graph of $*$-rings","anita lande, anil khairnar","combinatorics","let $r$ be a ring with involution $*$ and $z^*(r)$ denotes the set of all non-zero zero-divisors of $r$. we associate a simple (undirected) graph $\gamma'(r)$ with vertex set $z^*(r)$ and two distinct vertices $x$ and $y$ are adjacent in $\gamma'(r)$ if and only if $x^ny^*=0$ or $y^nx^*=0$, for some positive integer $n$. we find the diameter and girth of $\gamma'(r)$. the characterizations are obtained for $*$-rings having $\gamma'(r)$ a connected graph, a complete graph, and a star graph. further, we have shown that for a ring $r$, there is an involution on $r\times r$ such that $\gamma'(r\times r)$ is disconnected if and only if $r$ is an integral domain.",2024-03-15
"complete integrability of subriemannian geodesic flows on $\mathbb{s}^7$","wolfram bauer, abdellah laaroussi, daisuke tarama","differential geometry","four subriemannian (sr) structures over the euclidean sphere $\mathbb{s}^7$ are considered in accordance to the previous literature. the defining bracket generating distribution is chosen as the horizontal space in the hopf fibration, the quaternionic hopf fibration or spanned by a suitable number of canonical vector fields. in all cases the induced sr geodesic flow on $t^*\mathbb{s}^7$ is studied. adapting a method by a. thimm, a maximal set of functionally independent and poisson commuting first integrals are constructed, including the corresponding sr hamiltonian. as a result, the complete integrability in the sense of liouville is proved for the sr geodesic flow. it is observed that these first integrals arise as the symbols of commuting second order differential operators one of them being a (not necessarily intrinsic) sublaplacian. on the way one explicitly derives the lie algebras of all sr isometry groups intersected with $o(8)$.",2024-03-15
"gap results for biharmonic submanifolds in spheres","stefan andronic, simona nistor","differential geometry","in this paper we determine a larger gap of the mean curvature for a class of proper biharmonic submanifolds with parallel mean curvature vector field in euclidean spheres. when the bounds of the gap are reached, we obtain splitting results of the submanifold.",2024-03-15
